29468143,2018,Metagenomic Characterization of the Human Intestinal Microbiota in Fecal Samples from STEC-Infected Patients.,Frontiers in cellular and infection microbiology,Homo sapiens,NCBITaxon:9606,,,,,,,,,metagenomics,No,No
29343501,2018,Sequential BMP7/TGF-β1 signaling and microbiota instruct mucosal Langerhans cell differentiation.,The Journal of experimental medicine,,,,,,,,,,,,Yes,No
29273643,2018,Plasmacytoid dendritic cells protect from viral bronchiolitis and asthma through semaphorin 4a-mediated T reg expansion.,The Journal of experimental medicine,,,,,,,,,,,,No,No
29394894,2018,Differential effects of innate immune variants of surfactant protein-A1 (SFTPA1) and SP-A2 (SFTPA2) in airway function after Klebsiella pneumoniae infection and sex differences.,Respiratory research,Mus musculus,NCBITaxon:10090,,,,,,,,,,Yes,No
29394957,2018,Individual and household attributes influence the dynamics of the personal skin microbiota and its association network.,Microbiome,,,,skin,UBERON:0002097,,,,,,,Yes,No
29394954,2018,Crawling-induced floor dust resuspension affects the microbiota of the infant breathing zone.,Microbiome,Homo sapiens,NCBITaxon:9606,,,,,,,,,16S,Yes,No
29128130,2018,Spanish Guidelines on the Evaluation and Diagnosis of Bronchiectasis in Adults.,Archivos de bronconeumologia,,,,,,,,,,,,No,No
29092015,2018,MetaCherchant: analyzing genomic context of antibiotic resistance genes in gut microbiota.,"Bioinformatics (Oxford, England)",Homo sapiens,NCBITaxon:9606,,,,,,,,,metagenomics,Yes,No
27872184,2018,Functional variants in the sucrase-isomaltase gene associate with increased risk of irritable bowel syndrome.,Gut,Homo sapiens,NCBITaxon:9606,,feces,UBERON:0001988,,,,,,,Yes,No
29438602,2018,International Consensus Statement on Allergy and Rhinology: Allergic Rhinitis.,International forum of allergy & rhinology,Homo sapiens,NCBITaxon:9606,,,,,,,,,,No,No
29161417,2018,"Bolus Weekly Vitamin D3 Supplementation Impacts Gut and Airway Microbiota in Adults With Cystic Fibrosis: A Double-Blind, Randomized, Placebo-Controlled Clinical Trial.",The Journal of clinical endocrinology and metabolism,Homo sapiens,NCBITaxon:9606,,feces,UBERON:0001988,,,,,23,16S,Yes,No
29248229,2018,"Breastfeeding-associated microbiota in human milk following supplementation with Lactobacillus rhamnosus GG, Lactobacillus acidophilus La-5, and Bifidobacterium animalis ssp. lactis Bb-12.",Journal of dairy science,Homo sapiens,NCBITaxon:9606,,,,,,,,142,16S,Yes,No
29353387,2018,Inter-individual variation in health and disease associated with pulmonary infectious agents.,Mammalian genome : official journal of the International Mammalian Genome Society,Mus musculus,NCBITaxon:10090,,,,,,,,,,Yes,No
29384870,2018,Diversity analysis of subgingival microbial bacteria in peri-implantitis in Uygur population.,Medicine,Homo sapiens,NCBITaxon:9606,,,,,,,,40,16S,Yes,No
29105287,2018,"Gut Microbiota Interacts with Markers of Adipose Tissue Browning, Insulin Action and Plasma Acetate in Morbid Obesity.",Molecular nutrition & food research,Homo sapiens,NCBITaxon:9606,,,,,,,,34,,No,No
29432061,2018,Atorvastatin Treatment Modulates the Gut Microbiota of the Hypercholesterolemic Patients.,Omics : a journal of integrative biology,Homo sapiens,NCBITaxon:9606,,,,,,,,,16S,No,No
28618237,2018,Effect of Sweetened Dried Cranberry Consumption on Urinary Proteome and Fecal Microbiome in Healthy Human Subjects.,Omics : a journal of integrative biology,Homo sapiens,NCBITaxon:9606,,feces,UBERON:0001988,,,,,,16S,No,No
29471566,2018,Mucosal-Associated Invariant T Cells in Chronic Inflammatory Liver Disease.,Seminars in liver disease,Homo sapiens,NCBITaxon:9606,,,,,,,,,,Yes,No
29168036,2018,"The gut microbiome, symptoms, and targeted interventions in children with cancer: a systematic review.",Supportive care in cancer : official journal of the Multinational Association of Supportive Care in Cancer,Homo sapiens,NCBITaxon:9606,,,,,healthy,,,,,Yes,No
29434076,2018,Differences in Gut Microbiota Profiles between Autoimmune Pancreatitis and Chronic Pancreatitis.,The Tohoku journal of experimental medicine,Homo sapiens,NCBITaxon:9606,,feces,UBERON:0001988,,,,,12,other,Yes,No
29196292,2018,Gut Microbiota in Human Systemic Lupus Erythematosus and a Mouse Model of Lupus.,Applied and environmental microbiology,Mus musculus,NCBITaxon:10090,,,,,arthritis disease activity score measurement,EFO:0009435,,,,No,No
29385143,2018,Longitudinal microbiome analysis of single donor fecal microbiota transplantation in patients with recurrent Clostridium difficile infection and/or ulcerative colitis.,PloS one,Homo sapiens,NCBITaxon:9606,,feces,UBERON:0001988,,ulcerative colitis,MONDO:0005101,,,16S,Yes,No
29382366,2018,Age and fecal microbial strain-specific differences in patients with spondyloarthritis.,Arthritis research & therapy,Homo sapiens,NCBITaxon:9606,,feces,UBERON:0001988,,healthy,,,11,16S,Yes,No
28969444,2018,Different physiological properties of human-residential and non-human-residential bifidobacteria in human health.,Beneficial microbes,Homo sapiens,NCBITaxon:9606,,,,,,,,,,Yes,No
29081087,2018,Biotransformation of ,Journal of microbiology and biotechnology,Homo sapiens,NCBITaxon:9606,,feces,UBERON:0001988,,,,,,,No,No
29361936,2018,"Vaginal dysbiosis increases risk of preterm fetal membrane rupture, neonatal sepsis and is exacerbated by erythromycin.",BMC medicine,Homo sapiens,NCBITaxon:9606,,,,,,,,,16S,Yes,No
29362454,2018,Nonalcoholic fatty liver disease is associated with dysbiosis independent of body mass index and insulin resistance.,Scientific reports,Homo sapiens,NCBITaxon:9606,,feces,UBERON:0001988,,healthy,,,,,No,No
29351278,2018,Analysis of the tonsillar microbiome in young adults with sore throat reveals a high relative abundance of Fusobacterium necrophorum with low diversity.,PloS one,Homo sapiens,NCBITaxon:9606,,,,,,,,9,,Yes,No
29361092,2018,"Safety, Clinical Response, and Microbiome Findings Following Fecal Microbiota Transplant in Children With Inflammatory Bowel Disease.",Inflammatory bowel diseases,Homo sapiens,NCBITaxon:9606,,feces,UBERON:0001988,,inflammatory bowel disease,MONDO:0005265,,,,Yes,No
29348587,2018,"Comparative analyses of fecal microbiota in Chinese isolated Yao population, minority Zhuang and rural Han by 16sRNA sequencing.",Scientific reports,Homo sapiens,NCBITaxon:9606,,feces,UBERON:0001988,,,,,,16S,Yes,No
29682571,2018,The Association of Gut Microbiota with Nonalcoholic Steatohepatitis in Thais.,BioMed research international,Homo sapiens,NCBITaxon:9606,,feces,UBERON:0001988,,diabetes mellitus,EFO:0000400,,,16S,Yes,No
29269393,2018,Structural basis for the regulation of β-glucuronidase expression by human gut Enterobacteriaceae.,Proceedings of the National Academy of Sciences of the United States of America,Homo sapiens,NCBITaxon:9606,,,,,,,,,,No,No
29302014,2018,The commensal microbiome is associated with anti-PD-1 efficacy in metastatic melanoma patients.,"Science (New York, N.Y.)",Mus musculus,NCBITaxon:10090,,feces,UBERON:0001988,,cancer,MONDO:0004992,,,,Yes,No
29097494,2018,Gut microbiome influences efficacy of PD-1-based immunotherapy against epithelial tumors.,"Science (New York, N.Y.)",Mus musculus,NCBITaxon:10090,,feces,UBERON:0001988,,colorectal cancer,MONDO:0005575,,,metagenomics,No,No
29097493,2018,Gut microbiome modulates response to anti-PD-1 immunotherapy in melanoma patients.,"Science (New York, N.Y.)",Mus musculus,NCBITaxon:10090,,saliva,UBERON:0001836,,cancer,MONDO:0004992,,,,No,No
28767339,2018,Assessing gut microbiota perturbations during the early phase of infectious diarrhea in Vietnamese children.,Gut microbes,Homo sapiens,NCBITaxon:9606,,feces,UBERON:0001988,,,,,54,16S,Yes,No
29052237,2018,The taxonomic composition of the donor intestinal microbiota is a major factor influencing the efficacy of faecal microbiota transplantation in therapy refractory ulcerative colitis.,Alimentary pharmacology & therapeutics,Homo sapiens,NCBITaxon:9606,,feces,UBERON:0001988,,ulcerative colitis,MONDO:0005101,,17,16S,No,No
28829923,2018,High intake of dairy during energy restriction does not affect energy balance or the intestinal microflora compared with low dairy intake in overweight individuals in a randomized controlled trial.,"Applied physiology, nutrition, and metabolism = Physiologie appliquee, nutrition et metabolisme",Homo sapiens,NCBITaxon:9606,,feces,UBERON:0001988,,,,,69,,No,No
30793576,2018,"[Simplified Protocols for Cholera Diagnosis in the National Public Health Laboratory, Port-au-Prince, Haiti].",Bulletin de la Societe de pathologie exotique (1990),,,,feces,UBERON:0001988,,,,,,,Yes,No
27149343,2018,Nodular tracheobronchitis in a patient with lymphoma: an unusual presentation of viridans streptococcal respiratory tract infection.,The clinical respiratory journal,Homo sapiens,NCBITaxon:9606,,,,,,,,,,No,No
29049037,2018,Fractures and the gut microbiome.,Current opinion in HIV and AIDS,Mus musculus,NCBITaxon:10090,,,,,,,,,,Yes,No
29084074,2018,Clinical and symptom scores are significantly correlated with fecal microbiota features in patients with symptomatic uncomplicated diverticular disease: a pilot study.,European journal of gastroenterology & hepatology,Homo sapiens,NCBITaxon:9606,,feces,UBERON:0001988,,,,,,16S,Yes,No
28636759,2018,Rosacea and its association with enteral microbiota in Korean females.,Experimental dermatology,Homo sapiens,NCBITaxon:9606,,,,,,,,251,16S,No,No
30535609,2018,Microbiome and Gut Dysbiosis.,Experientia supplementum (2012),Homo sapiens,NCBITaxon:9606,,feces,UBERON:0001988,,obesity disorder,MONDO:0011122,,,,No,No
29161377,2018,Transmission and persistence of IncF conjugative plasmids in the gut microbiota of full-term infants.,FEMS microbiology ecology,Homo sapiens,NCBITaxon:9606,,,,,,,,,,Yes,No
27742762,2018,Human oral microbiome and prospective risk for pancreatic cancer: a population-based nested case-control study.,Gut,Homo sapiens,NCBITaxon:9606,,saliva,UBERON:0001836,,cancer,MONDO:0004992,,,16S,No,No
29543544,2018,Abundant production of exopolysaccharide by EAEC strains enhances the formation of bacterial biofilms in contaminated sprouts.,Gut microbes,,,,,,,,,,,,Yes,No
29469650,2018,Prenatal androgen exposure causes hypertension and gut microbiota dysbiosis.,Gut microbes,Rattus norvegicus,NCBITaxon:10116,,feces,UBERON:0001988,,,,,,,No,No
29494275,2018,The gut microbiota and immune checkpoint inhibitors.,Human vaccines & immunotherapeutics,Homo sapiens,NCBITaxon:9606,,,,,cancer,MONDO:0004992,,,metagenomics,Yes,No
29478734,2018,Lupus: The microbiome angle.,Immunobiology,,,,,,,,,,,,No,No
28479329,2018,Inflammatory phenotypes in patients with severe asthma are associated with distinct airway microbiology.,The Journal of allergy and clinical immunology,Homo sapiens,NCBITaxon:9606,,,,,,,,84,16S,Yes,No
29045349,2018,Male-specific Association Between Fat-Free Mass Index and Fecal Microbiota in 2- to 3-Year-Old Australian Children.,Journal of pediatric gastroenterology and nutrition,,,,feces,UBERON:0001988,,obesity disorder,MONDO:0011122,,18,16S,Yes,No
28561276,2018,Intestinal microbiota in patients with chronic hepatitis C with and without cirrhosis compared with healthy controls.,Liver international : official journal of the International Association for the Study of the Liver,Homo sapiens,NCBITaxon:9606,,,,,healthy,,,57,,Yes,No
30298261,2018,Analyzing Metabolic Pathways in Microbiomes.,"Methods in molecular biology (Clifton, N.J.)",,,,,,,,,,,other,Yes,No
30298256,2018,From RNA-seq to Biological Inference: Using Compositional Data Analysis in Meta-Transcriptomics.,"Methods in molecular biology (Clifton, N.J.)",Homo sapiens,NCBITaxon:9606,,,,,,,,,other,Yes,No
29195140,2018,"Are the decrease in circulating anti-α1,3-Gal IgG and the lower content of galactosyl transferase A1 in the microbiota of patients with multiple sclerosis a novel environmental risk factor for the disease?",Molecular immunology,Homo sapiens,NCBITaxon:9606,,,,,multiple sclerosis,MONDO:0005301,,,,Yes,No
28843021,2018,The nasal and gut microbiome in Parkinson's disease and idiopathic rapid eye movement sleep behavior disorder.,Movement disorders : official journal of the Movement Disorder Society,Homo sapiens,NCBITaxon:9606,,feces,UBERON:0001988,,healthy,,,,16S,Yes,No
28612844,2018,NLRP3 inflammasome pathway has a critical role in the host immunity against clinically relevant Acinetobacter baumannii pulmonary infection.,Mucosal immunology,Mus musculus,NCBITaxon:10090,,,,,,,,,,No,No
29689651,2018,High relative abundance of firmicutes and increased TNF-α levels correlate with obesity in children.,Salud publica de Mexico,,,,feces,UBERON:0001988,,obesity disorder,MONDO:0011122,,,,No,No
28888753,2018,"The Role of Gut Microbiome in the Pathogenesis of Prostate Cancer: A Prospective, Pilot Study.",Urology,Homo sapiens,NCBITaxon:9606,,feces,UBERON:0001988,,cancer,MONDO:0004992,,8,,Yes,No
24316595,2013,Human gut microbiome and risk for colorectal cancer.,Journal of the National Cancer Institute,Homo sapiens,NCBITaxon:9606,,feces,UBERON:0001988,,cancer,MONDO:0004992,,94,16S,Yes,No
